{
    "imageId": "",
    "patientId": "",
    "diseaseId": "",
    "imageModality": {
        "id": "",
        "label": ""
    },
    "imageBodyPart": {
        "id": "",
        "label": ""
    },
    "imageManufacturer": {
        "id": "",
        "label": ""
    },
    "dateOfImageAcquisition": ""
}